date,sentence,session_id
2024-07-08 13:31:22.700655,"Georgette has been navigating her love journey with a mix of hope and caution. She has expressed concerns about finding a genuine connection and the challenges that come with dating in today's world. Despite these concerns, she remains optimistic and open to new experiences.

In her career, Georgette has been facing some challenges and uncertainties. She has expressed feelings of stress and overwhelm, which at times have affected her emotional well-being and her approach to love. However, she is proactive in seeking solutions and support, showing resilience and determination in the face of adversity.

Georgette values open communication and emotional intelligence in relationships. She believes in the importance of understanding and respecting each other's boundaries. She has also shown a willingness to learn and grow from her past experiences.

In terms of self-care, Georgette recognizes its importance but sometimes struggles to prioritize it amidst her career and personal life. She could benefit from incorporating more self-care practices to help manage stress and maintain a positive mindset.

In summary, Georgette is a resilient and optimistic individual navigating the complexities of love and career. She values meaningful connections and personal growth. Encouraging her to continue prioritizing self-care and maintaining a positive outlook could be beneficial in her journey.",1
